time,value
121.9,2010-01-01,2010-12-31,38.0441,"EVANSVILLE REGIONAL AIRPORT, IN US",1,GHCND:USW00093817,METERS,-87.5205
241.1,2010-01-01,2010-12-31,39.72517,"INDIANAPOLIS INTERNATIONAL AIRPORT, IN US",1,GHCND:USW00093819,METERS,-86.28168
298.7,2010-01-01,2010-12-31,38.0408,"LEXINGTON BLUEGRASS AIRPORT, KY US",1,GHCND:USW00093820,METERS,-84.6058
148.7,2010-01-01,2010-12-31,38.1811,"LOUISVILLE INTERNATIONAL AIRPORT, KY US",1,GHCND:USW00093821,METERS,-85.7391
181.1,2010-01-01,2010-12-31,39.8447,"SPRINGFIELD ABRAHAM LINCOLN CAPITAL AIRPORT, IL US",1,GHCND:USW00093822,METERS,-89.6839
119.5,2010-01-01,2010-12-31,32.5161,"COLUMBUS METROPOLITAN AIRPORT, GA US",1,GHCND:USW00093842,METERS,-84.9422
110,2010-01-01,2010-12-31,34.2622,"TUPELO REGIONAL AIRPORT, MS US",1,GHCND:USW00093862,METERS,-88.7713
696.5,2010-01-01,2010-12-31,48.2138,"GLASGOW INTERNATIONAL AIRPORT, MT US",1,GHCND:USW00094008,METERS,-106.6214
787.9,2010-01-01,2010-12-31,48.5428,"HAVRE AIRPORT ASOS, MT US",1,GHCND:USW00094012,METERS,-109.7633
579.7,2010-01-01,2010-12-31,48.1738,"WILLISTON SLOULIN FIELD INTERNATIONAL AIRPORT, ND US",1,GHCND:USW00094014,METERS,-103.6366
1261.9,2010-01-01,2010-12-31,43.595,"BURNS MUNICIPAL AIRPORT, OR US",1,GHCND:USW00094185,METERS,-118.9564
2.7,2010-01-01,2010-12-31,46.1569,"ASTORIA AIRPORT PORT OF, OR US",1,GHCND:USW00094224,METERS,-123.8825
56.4,2010-01-01,2010-12-31,47.9375,"QUILLAYUTE STATE AIRPORT, WA US",1,GHCND:USW00094240,METERS,-124.555
1.5,2010-01-01,2010-12-31,41.1583,"IGOR I SIKORSKY MEMORI AIRPORT, CT US",0.7087,GHCND:USW00094702,METERS,-73.1289
304.8,2010-01-01,2010-12-31,42.2706,"WORCESTER, MA US",1,GHCND:USW00094746,METERS,-71.8731
3.4,2010-01-01,2010-12-31,40.6386,"JFK INTERNATIONAL AIRPORT, NY US",1,GHCND:USW00094789,METERS,-73.7622
350.8,2010-01-01,2010-12-31,44.3591,"HOUGHTON LAKE ROSCOMMON CO AIRPORT, MI US",0.9369,GHCND:USW00094814,METERS,-84.6738
222.5,2010-01-01,2010-12-31,42.1927,"ROCKFORD GREATER ROCKFORD AIRPORT, IL US",1,GHCND:USW00094822,METERS,-89.093
366.7,2010-01-01,2010-12-31,40.4846,"PITTSBURGH ASOS, PA US",1,GHCND:USW00094823,METERS,-80.2144
205.4,2010-01-01,2010-12-31,41.5871,"TOLEDO EXPRESS AIRPORT, OH US",1,GHCND:USW00094830,METERS,-83.8055
201.8,2010-01-01,2010-12-31,41.995,"CHICAGO OHARE INTERNATIONAL AIRPORT, IL US",1,GHCND:USW00094846,METERS,-87.9336
192.3,2010-01-01,2010-12-31,42.2313,"DETROIT METROPOLITAN AIRPORT, MI US",1,GHCND:USW00094847,METERS,-83.3308
208.5,2010-01-01,2010-12-31,45.0716,"ALPENA CO REGIONAL AIRPORT, MI US",1,GHCND:USW00094849,METERS,-83.5644
244.8,2010-01-01,2010-12-31,42.8825,"GRAND RAPIDS GERALD R FORD INTERNATIONAL AIRPORT, MI US",1,GHCND:USW00094860,METERS,-85.52389
321.9,2010-01-01,2010-12-31,42.39778,"DUBUQUE REGIONAL AIRPORT, IA US",0.7828,GHCND:USW00094908,METERS,-90.70361
264.6,2010-01-01,2010-12-31,42.5544,"WATERLOO MUNICIPAL AIRPORT, IA US",1,GHCND:USW00094910,METERS,-92.4011
